{
  "templateSchemaVersion": "0.1.0",
  "templateType": "device",
  "device": {
    "name": "Carbonite Ultra Solo",
    "subName": "SW",
    "manufacturer": "Ross",
    "model": "Carbonite Solo CUF-112",
    "categoryName": "Video",
    "rackSizeRu": null
  },
  "ioInterfaces": [
    {
      "name": "SW IN",
      "direction": "input",
      "categoryName": "Video",
      "connectorName": "Micro BNC",
      "count": 12,
      "portLabelPattern": "{I/O NAME}-{00}",
      "color": "#2563EB"
    },
    {
      "name": "SW OUT",
      "direction": "output",
      "categoryName": "Video",
      "connectorName": "Micro BNC",
      "count": 5,
      "portLabelPattern": "{I/O NAME}-{00}",
      "color": "#2563EB"
    },
    {
      "name": "REF IN",
      "direction": "input",
      "categoryName": "Reference",
      "connectorName": "BNC",
      "count": 1,
      "portLabelPattern": "{I/O NAME}",
      "color": "#7C3AED"
    },
    {
      "name": "REF OUT",
      "direction": "output",
      "categoryName": "Reference",
      "connectorName": "BNC",
      "count": 1,
      "portLabelPattern": "{I/O NAME}",
      "color": "#7C3AED"
    },
    {
      "name": "ETH",
      "direction": "bidirectional",
      "categoryName": "Network",
      "connectorName": "RJ45",
      "count": 1,
      "portLabelPattern": "{I/O NAME}",
      "color": "#059669"
    }
  ]
}
